<?xml version="1.0" encoding="UTF-8" ?>

<!-- XML in easy steps - Page 62. -->

<xsd:schema xmlns:xsd="http://www.w3.org/2001/XMLSchema">

<!-- DECLARE ELEMENTS. -->

<!-- Simple types. -->
<xsd:element name="int" type="xsd:integer" />
<xsd:element name="pos" type="xsd:positiveInteger" /> 
<xsd:element name="neg" type="xsd:nonPositiveInteger" /> 
<xsd:element name="dec" type="xsd:decimal" /> 
<xsd:element name="flt" type="xsd:float" /> 

<!-- Complex types. -->
<xsd:element name="doc" type="docType"/>


<!-- DEFINE STRUCTURE. -->
<xsd:complexType name="docType">
	<xsd:sequence>
		<xsd:element ref="int" maxOccurs="unbounded"/>
		<xsd:element ref="pos" maxOccurs="unbounded"/>
		<xsd:element ref="neg" maxOccurs="unbounded"/>
		<xsd:element ref="dec" maxOccurs="unbounded"/>
		<xsd:element ref="flt" maxOccurs="unbounded"/>
	</xsd:sequence>
</xsd:complexType>
	
</xsd:schema>
